{
  "_spdx": "GPL-3.0-only",
  "schema": 1,
  "status": "blocked",
  "reason": "The OpenGlide9x file and license closure has not been reviewed.",
  "upstream_name": "openglide9x",
  "owning_commit": "b8ac1a32c98f9f8e8616aeffcf4b0af163b59b8f",
  "source_prefixes": [],
  "notices": [],
  "files": []
}
